authorizer,enterer,modifier,reference_no,author1init,author1last,author2init,author2last,otherauthors,pubyr,reftitle,pubtitle,editors,pubvol,pubno,firstpage,lastpage,publication_type,basis,language,doi,comments,project_name,project_ref_no,created,modified
"M. Clapham","M. Clapham",,29742,"J. M.",Dickins,,,,1989,"Youngest Permian marine macrofossil fauna from the Bowen and Sydney basins, eastern Australia","BMR Journal of Australian Geology and Geophysics",,11,,63,79,"journal article","stated with evidence",English,,,,,"2009-04-17 17:11:34","2009-04-18 10:11:34"
"M. Clapham","M. Clapham",,32403,M.,Dixon,"D. W.",Haig,,2004,"Foraminifera and their habitats within a cool-water carbonate succession following glaciation, Early Permian (Sakmarian), Western Australia","Journal of Foraminiferal Research",,34,,308,324,"journal article","none discussed",English,,,,,"2010-04-07 17:44:48","2010-04-08 10:44:48"
"M. Clapham","M. Clapham",,33481,"B. A.",Engel,"J. R.",Laurie,,1978,"A new species of the Permian trilobita Doublatia from the Manning District, New South Wales",Alcheringa,,2,,49,54,"journal article","stated with evidence",English,,,,,"2010-08-28 19:50:29","2010-08-29 12:50:29"
"P. Wagner","P. Wagner","M. Clapham",26702,R.,Etheridge,,,,1872,"Description of the Palaeozoic and Mesozoic fossils of Queensland","Quarterly Journal of the Geological Society of London",,28,,317,360,"journal article","stated without evidence",English,,,,,"2008-03-13 12:32:05","2012-07-30 11:56:13"
"M. Clapham","M. Clapham","M. Clapham",39465,R.,"Etheridge Jr.",,,,1880,"On a collection of fossils from the Bowen River coalfield and the limestone of the Fanning River, north Queensland","Proceedings of the Royal Physical Society of Edinburgh",,5,,263,328,"journal article","stated without evidence",English,,,,,"2012-01-16 10:39:16","2012-08-03 15:49:52"
"M. Clapham","M. Clapham","M. Clapham",42464,R.,"Etheridge Jr.",,,,1889,"Remarks on fossils of Permo-Carboniferous age, from north-western Australia, in the Macleay Museum","Proceedings of the Linnean Society of New South Wales, Series 2",,4,,199,214,"journal article","stated with evidence",English,,,,,"2012-07-27 03:28:17","2012-08-03 15:51:02"
"M. Clapham","M. Clapham","M. Clapham",42529,R.,"Etheridge Jr.",,,,1894,"Palaeontologia novae cambriae meridionalis: occasional descriptions of New South Wales Fossils, No. 1","Records of the Geological Survey of New South Wales",,4,,32,37,"journal article","stated with evidence",English,,,,,"2012-08-02 07:57:09","2012-08-03 15:51:14"
"M. Clapham","M. Clapham",,43251,R.,"Etheridge Jr.",,,,1898,"Palaeontologia Novae Cambriae Meridionalis - occasional descriptions of New South Wales fossils, no. 3","Records of the Geological Survey of New South Wales",,5,4,175,179,"journal article","stated without evidence",English,,,,,"2012-10-10 09:11:52","2012-10-10 09:11:52"
"M. Clapham","M. Clapham","M. Clapham",42532,R.,"Etheridge Jr.",,,,1902,"Palaentologia novae cambriae meridionalis - occasional descriptions of New South Wales fossils, no. 4","Records of the Geological Survey of New South Wales",,7,,66,69,"journal article","stated with evidence",English,,,,,"2012-08-02 15:07:44","2012-08-03 15:51:41"
"M. Clapham","M. Clapham","M. Clapham",42467,R.,"Etheridge Jr.",,,,1903,"Descriptions of Carboniferous fossils from the Gascoyne District, Western Australia, collected by Mr. A. Gibb Maitland, government geologist","Western Australia Geological Survey Bulletin",,10,,1,31,"journal article","stated with evidence",English,,,,,"2012-07-27 05:10:41","2012-08-03 15:52:17"
"M. Clapham","M. Clapham","M. Clapham",42520,R.,"Etheridge Jr.",,,,1907,"Fossils from Mingenew, Irwin River Coalfield, Western Australia, collected by Mr. E. S. Simpson, mineralogist and assayer","Geological Survey of Western Australia Bulletin",,27,,19,25,"journal article","stated with evidence",English,,,,,"2012-08-01 10:36:36","2012-08-03 15:52:27"
"M. Clapham","M. Clapham","M. Clapham",42521,R.,"Etheridge Jr.",,,,1907,"Descriptions of Carboniferous fossils from the Irwin River, collected by Mr. C. F. V. Jackson, late Assistant Government Geologist","Geological Survey of Western Australia Bulletin",,27,,26,37,"journal article","stated with evidence",English,,,,,"2012-08-01 10:48:23","2012-08-03 15:52:38"
"M. Clapham","M. Clapham",,42548,R.,"Etheridge Jr.",,,,1907,"Official contributions to the palaeontology of South Australia, No. 17 - Permo-Carboniferous fossils of Cape Ford, Anson Bay, and Cape Dombey, Hyland Bay","South Australian Parliamentary Paper",,55,Suppl,5,6,"journal article","stated with evidence",English,,,,,"2012-08-04 11:44:54","2012-08-04 11:44:54"
"M. Clapham","M. Clapham",,42549,R.,"Etheridge Jr.",,,,1907,"Official contributions to the palaeontology of South Australia, No. 18 - Carboniferous fossils from Fossil Head, Treachery Bay, Victoria River estuary","South Australian Parliamentary Paper",,55,Suppl,6,11,"journal article","stated with evidence",English,,,,,"2012-08-04 12:05:34","2012-08-04 12:05:34"
"M. Clapham","M. Clapham",,42550,R.,"Etheridge Jr.",,,,1907,"Official contributions to the palaeontology of South Australia, No. 19 - Fossils of the Port Keats bore, thirty miles north of Fossil Head, Treachery Bay","South Australian Parliamentary Paper",,55,Suppl,11,15,"journal article","stated with evidence",English,,,,,"2012-08-04 14:12:18","2012-08-04 14:12:18"
"M. Clapham","M. Clapham","M. Clapham",42489,R.,"Etheridge Jr.",,,,1915,"Western Australian Carboniferous fossils, chiefly from Mount Marmion, Lennard River, West Kimberley","Western Australia Geological Survey Bulletin",,58,,7,59,"journal article","stated with evidence",English,,,,,"2012-07-30 13:01:05","2012-08-04 09:16:06"
"M. Clapham","M. Clapham","M. Clapham",42916,R.,"Etheridge Jr.",,,,1919,"Palaeontologia Novae Cambriae Meridionalis - occasional descriptions of New South Wales fossils - No. 7","Records of the Australian Museum",,12,9,183,192,"journal article","stated with evidence",English,,,,,"2012-09-09 05:59:09","2012-09-09 06:00:25"
"M. Clapham","M. Clapham",,42594,R.,"Etheridge Jr.","W. S.",Dun,,1909,"Notes on the Permo-Carboniferous Producti of eastern Australia, with synonymy","Records of the Geological Survey of New South Wales",,8,,293,304,"journal article","stated without evidence",English,,,,,"2012-08-13 10:28:41","2012-08-13 10:28:41"
"M. Clapham","M. Clapham",,46877,R.,"Etheridge Jr.","W. S.",Dun,,1910,"A monograph of the Carboniferous and Permo-Carboniferous invertebrata of New South Wales. Vol II - Pelecyopoda. Part II - Eurydesma","Memoirs of the Geological Survey of New South Wales, Palaeontology",,5,,41,75,"journal article","stated with evidence",English,,,,,"2013-05-19 05:41:04","2013-05-19 05:41:04"
"M. Clapham","M. Clapham",,42527,"H. O.",Fletcher,,,,1938,"A revision of the Australian Conulariae","Records of the Australian Museum",,20,,235,255,"journal article","stated with evidence",English,,,,,"2012-08-02 07:22:58","2012-08-02 07:22:58"
"P. Wagner","P. Wagner",,15909,H.O.,Fletcher,,,,1943,"The genus Conocardium from Australian Palaeozoic rocks","Records of the Australian Museum",,21,4,231,243,"journal article","stated without evidence",English,,,,,"2006-01-25 10:44:26","2006-01-26 05:44:26"
"M. Clapham","M. Clapham",,35945,"H. O.",Fletcher,,,,1945,"A new Aulosteges from the Lower Permian of Queensland","Records of the Australian Museum",,21,6,313,316,"journal article","stated with evidence",English,,,,,"2011-04-29 13:55:04","2011-04-29 13:55:04"
"M. Clapham","M. Clapham","M. Clapham",27330,"H. O.",Fletcher,,,,1946,"New Lamellibranchia from the upper Permian of Western Australia","Records of the Australian Museum",,21,,395,405,"journal article","stated with evidence",English,,,,,"2008-06-07 10:00:17","2008-08-25 06:11:33"
"P. Wagner","P. Wagner",,26631,H.O.,Fletcher,,,,1958,"The Permian gastropods of New South Wales","Records of the Australian Museum",,24,10,115,164,"journal article","stated without evidence",English,,,,,"2008-03-06 18:46:33","2008-03-07 13:46:33"
"G. Webster","G. Webster","M. Clapham",20849,"A. H.",Foord,,,,1890,"Notes on the palaeontology of Western Australia","Geological Magazine, New Series, Decade III",,7,,98,106,"journal article","stated without evidence",English,,,,,"2007-02-26 19:03:53","2012-07-27 01:11:47"
"M. Clapham","M. Clapham","M. Clapham",42461,"A. H.",Foord,,,,1890,"Notes on the palaeontology of Western Australia, continued","Geological Magazine, New Series, Decade III",,7,,145,155,"journal article","stated with evidence",English,,,,,"2012-07-27 01:10:49","2013-04-03 09:18:15"
"M. Clapham","M. Clapham",,29623,"C. B.",Foster,"J. B.",Waterhouse,,1988,"The Granulatisporites confluens Oppel-zone and Early Permian marine faunas from the Grant Formation on the Barbwire Terrace, Canning Basin, Western Australia","Australian Journal of Earth Sciences",,35,,135,157,"journal article","stated without evidence",English,,,,,"2009-04-03 22:51:39","2009-04-04 16:51:39"
"M. Clapham","M. Clapham",,42519,L.,Glauert,,,,1912,"Permo-Carboniferous fossils from Byro Station, Murchison District","Records of the Western Australian Museum",,1,,75,77,"journal article","stated with evidence",English,,,,,"2012-08-01 09:40:18","2012-08-01 09:40:18"
"M. Clapham","M. Clapham",,33509,"B. F.",Glenister,C.,Baker,"W. M. Furnish, G. A. Thomas",1990,"Additional Early Permian ammonoid cephalopods from Western Australia","Journal of Paleontology",,64,,392,399,"journal article","stated with evidence",English,,,,,"2010-08-28 20:43:50","2010-08-29 13:43:50"
"M. Clapham","M. Clapham",,27840,"B. F.",Glenister,"W. M.",Furnish,,1961,"The Permian ammonoids of Australia","Journal of Paleontology",,35,4,673,736,"journal article","stated without evidence",English,,,,,"2008-08-01 18:46:04","2008-08-02 11:46:04"
"M. Clapham","M. Clapham",,28547,"B. F.",Glenister,"D. L.","Windle Jr.","W. M. Furnish",1973,"Australasian Metalegoceratidae (Lower Permian ammonoids)","Journal of Paleontology",,47,6,1031,1043,"journal article","stated with evidence",English,,,,,"2008-11-21 12:11:50","2008-11-22 07:11:50"
"M. Clapham","M. Clapham",,46820,D.,Hill,,,,1942,"Further Permian corals from Western Australia","Journal of the Royal Society of Western Australia",,27,,57,72,"journal article","stated with evidence",English,,,,,"2013-05-15 04:17:06","2013-05-15 04:17:06"
"M. Clapham","M. Clapham",,42455,"G. J.",Hinde,,,,1890,"Notes on the palaeontology of Western Australia 2. Corals and Polyzoa","Geological Magazine, New Series, Decade III",,7,,194,204,"journal article","stated with evidence",English,,,,,"2012-07-26 08:38:20","2012-07-26 08:38:20"
"M. Clapham","M. Clapham",,33543,T.,Hogeboom,"N. W.",Archbold,,1999,"Additional specimens of Early Permian brachiopods from the Callytharra Formation, Carnarvon Basin, Western Australia: new morphological data","Proceedings of the Royal Society of Victoria",,111,,255,269,"journal article","stated with evidence",English,,,,,"2010-08-29 15:42:57","2010-08-30 08:42:57"
"M. Clapham","M. Clapham",,38496,"W. H.",Hudleston,,,,1883,"Notes on a collection of fossils and of rock-specimens from west Australia, north of the Gascoyne River","Quarterly Journal of the Geological Society",,39,,582,595,"journal article","stated without evidence",English,,,,,"2011-11-12 16:53:24","2011-11-12 16:53:24"
"M. Clapham","M. Clapham",,30058,"E. G.",Kauffman,B.,Runnegar,,1975,"Atomodesma (Bivalvia), and Permian species of the United States","Journal of Paleontology",,49,1,23,41,"journal article","stated with evidence",English,,,,,"2009-06-07 08:23:53","2009-06-08 01:23:53"
"M. Clapham","M. Clapham","M. Clapham",41707,"W. Z.",Li,"G. R.",Shi,"Y. Ariunchimeg, W. H. He, S. Z. Shen",2012,"Cancrinella and Costatumulus (Brachiopoda) from the Permian of South Mongolia and South China: their morphology, biostratigraphy and distribution",Geobios,,45,,297,309,"journal article","stated with evidence",English,,,,,"2012-05-22 07:53:39","2012-07-03 10:17:06"
"G. Webster","G. Webster","M. Clapham",21658,F.,"M'Coy",,,,1847,"XXI. On the fossil botany and zoology of the rocks associated with the coal of Australia","Annals and Magazine of Natural History",,20,133,226,236,"journal article","stated without evidence",English,,"pl. 9-17. ",,,"2007-02-26 19:05:05","2011-11-13 14:35:04"
"M. Clapham","M. Clapham","M. Clapham",38505,F.,"M'Coy",,,,1847,"XXVIII. On the fossil botany and zoology of the rocks associated with the coal of Australia","The Annals and Magazine of Natural History",,20,134,298,312,"journal article","stated without evidence",English,,"November, 1847",,,"2011-11-13 14:37:10","2013-04-03 06:22:04"
"M. Clapham","M. Clapham",,28777,"J. M.",Malinky,,,,2009,"Permian Hyolithida from Australia: the last of the hyoliths?","Journal of Paleontology",,83,1,147,152,"journal article","stated with evidence",English,,,,,"2008-12-12 21:22:18","2008-12-13 16:22:18"
"P. Wagner","P. Wagner",,26717,W.G.H.,Maxwell,,,,1954,"Strophalosia in the Permian of Queensland","Journal of Paleontology",,28,5,535,559,"journal article","stated without evidence",English,,,,,"2008-03-14 11:03:44","2008-03-15 05:03:44"
"P. Wagner","P. Wagner","M. Clapham",26800,"W. G. H.",Maxwell,,,,1964,"The geology of the Yarrol Region. Part 1. Biostratigraphy","Papers - Department of Geology, University of Queensland",,5,9,1,60,"serial monograph","stated with evidence",English,,,,,"2008-03-19 13:05:26","2013-05-26 07:09:58"
"M. Clapham","M. Clapham",,34807,B.,McCarthy,B.,Runnegar,"J. D. Kleeman",1974,"Late Carboniferous-Early Permian sequence north of Drake, NSW: dates, deposition, and deformation of Beenleigh block","Queensland Government Mining Journal",,75,,325,329,"journal article","stated without evidence",English,,,,,"2011-01-19 17:01:13","2011-01-19 17:01:13"
"M. Clapham","M. Clapham",,34897,G.,McClung,,,,1977,"Appendix: Invertebrate fossils from GSQ Taroon 11-11A","Queensland Government Mining Journal",,78,914,629,,"journal article","stated without evidence",English,,,,,"2011-01-27 13:51:14","2011-01-27 13:51:14"
"M. Clapham","M. Clapham","M. Clapham",34898,G.,McClung,,,,1977,"Permian marine invertebrate macrofossils - GSQ Taroom 10","Queensland Government Mining Journal",,78,913,574,578,"journal article","stated without evidence",English,,,,,"2011-01-27 16:30:19","2011-01-27 16:54:04"
"M. Clapham","M. Clapham",,36711,G.,McClung,,,,1978,"Morphology, palaeocology and biostratigraphy of Ingelarella (Brachiopoda : Spiriferida) in the Bowen and Sydney Basins of Eastern Australia","Geological Survey of Queensland Publication",,365,,17,87,"journal article","stated with evidence",English,,,,,"2011-07-18 13:55:41","2011-07-18 13:55:41"
"M. Clapham","M. Clapham",,34854,"G. R.",McClung,,,,1983,"Faunal sequence and palaeoecology of the marine Permian in GSQ Eddystone 1, Denison Trough, Queensland","Geological Survey of Queensland Publication",,384,,43,80,"serial monograph","stated with evidence",English,,,,,"2011-01-22 13:38:11","2011-01-22 13:38:11"
"M. Clapham","M. Clapham",,33598,G.,McClung,J.,Armstrong,,1975,"New species of Martiniopsis (Brachiopoda: Spiriferida) from the Permian of eastern Australia","Queensland Government Mining Journal",,76,,231,234,"journal article","stated with evidence",English,,,,,"2010-08-29 18:29:52","2010-08-30 11:29:52"
"M. Clapham","M. Clapham",,27930,G.,McClung,J.,Armstrong,,1978,"Species of Glendonia gen. nov. (Ingelarellinae: Spiriferida) in the Permian of eastern Australia","Geological Survey of Queensland Publication",,365,,1,5,"journal article","stated without evidence",English,,,,,"2008-08-10 10:01:27","2008-08-11 03:01:27"
"A. McGowan","A. McGowan","A. McGowan",12967,"R. A.",McTavish,"J. M.",Dickins,,1974,"The age of the Kockatea Shale (Lower Triassic), Perth Basin-a reassessment","Journal of the Geological Society of Australia",,21,,95,211,"journal article","stated without evidence",,,,,,"2005-03-24 05:23:48","2005-03-25 00:23:48"
"M. Clapham","M. Clapham","M. Clapham",27325,"A. K.",Miller,"W. M.",Furnish,,1940,"Permian ammonoids of the Guadalupe Mountain region and adjacent area","Geological Society of America Special Paper",,26,,1,242,"serial monograph","stated without evidence",English,,,,,"2008-06-07 08:55:05","2012-07-21 16:05:11"
"M. Clapham","M. Clapham",,28682,"I. P.",Morozova,,,,2004,"New Early Permian bryozoans of eastern Australia","Paleontological Journal",,38,4,381,392,"journal article","stated with evidence",English,,,,,"2008-12-06 13:59:43","2008-12-07 08:59:43"
"M. Clapham","M. Clapham","M. Clapham",27516,"N. J.",Morris,"J. M.",Dickins,"K. Astafieva-Urbaitis",1991,"Upper Palaeozoic Anomalodesmatan Bivalvia","Bulletin of the British Museum of Natural History (Geology)",,47,1,51,100,"journal article","stated without evidence",English,,,,,"2008-06-30 11:16:31","2013-04-03 08:30:48"
"M. Clapham","M. Clapham","M. Clapham",27341,"V. A.",Muromtseva,"V. A.",Guskov,,1984,,"Permskie Morskie Otlozheniya I Dvustvorchatie Mollyuski Sovetskoi Arktiki",,,,1,154,"book/book chapter","stated with evidence",Russian,,,,,"2008-06-07 13:15:29","2013-04-07 06:18:01"
"M. Clapham","M. Clapham",,42463,"R. B.",Newton,,,,1892,"On the occurrence of Chonetes pratti, Davidson, in the Carboniferous rocks of Western Australia","Geological Magazine, New Series, Decade III",,9,,542,544,"journal article","stated with evidence",English,,,,,"2012-07-27 02:54:47","2012-07-27 02:54:47"
"M. Clapham","M. Clapham","M. Clapham",34808,"S. M.",Parfrey,,,,1984,"Permian marine invertebrate macrofossils - GSQ Mundubbera 11","Records of the Geological Survey of Queensland",,1984,34,1,13,"serial monograph","none discussed",English,,,,,"2011-01-19 17:48:18","2011-09-06 08:13:24"
"M. Clapham","M. Clapham","M. Clapham",37461,"S. M.",Parfrey,,,,1984,"Permian fossils from the Gayndah 1 100,000 sheet area","Records of the Geological Survey of Queensland",,1984,18,1,2,"serial monograph","none discussed",English,,,,,"2011-09-06 07:45:12","2011-09-06 08:13:08"
"M. Clapham","M. Clapham","M. Clapham",34894,"S. M.",Parfrey,,,,1985,"Reports on Permian faunas","Records of the Geological Survey of Queensland",,1985,17,1,12,"serial monograph","none discussed",English,,,,,"2011-01-26 15:26:37","2011-09-06 08:13:39"
"M. Clapham","M. Clapham",,33644,"S. M.",Parfrey,,,,1986,"Early Permian invertebrates from the Camboon Andesite near Biloela, southeastern Bowen Basin","Geological Survey of Queensland Publication",,387,,57,67,"journal article","stated with evidence",English,,,,,"2010-08-29 19:33:46","2010-08-30 12:33:46"
"N. Heim","N. Heim",,15693,S.,Peou,,,,1979,"A new athyridacean brachiopod from the Carboniferous of Rawdon Vale, New South Wales",Alcheringa,,3,,189,195,"journal article","stated without evidence",English,,"The systematic description in this paper is limited to a single new species, however complete faunal lists (for brachiopods) is included for two sections.",,,"2006-01-23 14:07:50","2006-01-24 09:07:59"
"J. Alroy","M. Sommers","J. Alroy",562,S.,Peou,"B. A.",Engel,,1979,"A Carboniferous fauna from Rawdon Vale, New South Wales",Alcheringa,,3,,141,157,"journal article","not entered",English,,,,,"2000-06-29 11:49:48","2009-11-23 10:10:57"
"M. Clapham","M. Clapham",,28681,"J. R. P.","Phillips Ross",,,,1963,"Lower Permian Bryozoa from Western Australia",Palaeontology,,6,1,70,82,"journal article","stated with evidence",English,,,,,"2008-12-06 13:48:30","2008-12-07 08:48:30"
"D. Bottjer","C. Powers",,18569,"C. M.",Reid,,,,2003,"Permian Bryozoa of Tasmania and New South Wales: systematics and their use in Tasmanian biostratigraphy","Association of Australasian Palaeontologists, Memoir",,28,,1,133,"serial monograph","stated with evidence",English,,,,,"2006-09-06 16:56:42","2006-09-07 09:56:42"
"N. Heim","N. Heim",,15598,J,Roberts,,,,1963,"A lower Carboniferous fauna from Lewinsbrook, New South Wales","Journal and Proceedings of the Royal Society of New South Wales",,97,,1,29,"journal article","stated without evidence",English,,"Page numbers do not include 6 plates",,,"2006-01-16 10:14:51","2006-01-17 05:14:51"
"N. Heim","N. Heim",,15599,J.,Roberts,,,,1964,"Lower Carboniferous Faunas from Wiragulla and Dungog, New South Wales","Journal and Proceedings of the Royal Society of New South Wales",,97,6A,193,215,"journal article","stated without evidence",English,,,,,"2006-01-16 12:00:02","2006-01-17 07:01:38"
"N. Heim","N. Heim",,18073,J.,Roberts,,,,1964,"Lower Carboniferous brachiopods from Greenhills, New South Wales","Journal of the Geological Soceity of Australia",,10,,173,194,"journal article","stated without evidence",English,,,,,"2006-07-24 16:24:11","2006-07-25 09:24:27"
"J. Alroy","M. Sommers","J. Alroy",336,J.,Roberts,,,,1965,"A Lower Carboniferous fauna from Trevallyn, New South Wales",Palaeontology,,8,1,54,81,"journal article","stated without evidence",,,,,,"1999-10-23 14:20:46","2009-11-23 10:09:18"
"N. Heim","N. Heim","N. Heim",12447,J.,Roberts,,,,1975,"Early Carboniferous brachiopod zones of eastern Australia","Journal of the Geological Society of Australia",,22,1,1,31,"journal article","stated without evidence",,,,,,"2005-01-24 07:07:51","2005-01-25 05:12:03"
"N. Heim","N. Heim",,15600,J.,Roberts,"J. W.",Hunt,"D. M. Thompson",1976,"Late Carboniferous marine invertebrate zones of eastern Australia",Alcheringa,,1,,197,225,"journal article","stated without evidence",English,,,,,"2006-01-16 14:05:17","2006-01-17 09:05:31"
"M. Clapham","M. Clapham",,37509,B.,Runnegar,,,,1965,"The bivalves Megadesmus Sowerby and Astartila Dana from the Permian of eastern Australia","Journal of the Geological Society of Australia",,12,2,227,252,"journal article","stated with evidence",English,,,,,"2011-09-07 15:24:32","2011-09-07 15:24:32"
"M. Clapham","M. Clapham",,42917,B.,Runnegar,,,,1967,"Desmodont bivalves from the Permian of eastern Australia","Bureau of Mineral Resources, Geology and Geophysics Bulletin",,96,,1,108,"serial monograph","stated with evidence",English,,,,,"2012-09-09 07:29:56","2012-09-09 07:29:56"
"M. Clapham","M. Clapham",,46867,B.,Runnegar,,,,1970,"Eurydesma and Glendella gen. nov. (Bivalvia) in the Permian of eastern Australia","Bureau of Mineral Resources, Geology and Geophysics Bulletin",,116,,83,118,"serial monograph","stated with evidence",English,,,,,"2013-05-18 08:24:09","2013-05-18 08:24:09"
"M. Clapham","M. Clapham",,38501,"G. B.",Sowerby,,,,1844,"Palaeozoic shells from Van Diemen's Land","Geological Observations on the Volcanic Islands Visited during the Voyage of HMS Beagle","C. Darwin",,,158,160,"book/book chapter","stated without evidence",English,,,,,"2011-11-13 06:29:50","2011-11-13 06:29:50"
"M. Clapham","M. Clapham",,27469,F.G.,Stehli,,,,1961,"New terebratuloid genera from Australia","Journal of Paleontology",,35,3,451,456,"journal article","stated without evidence",English,,,,,"2008-06-27 19:23:53","2008-06-28 12:23:53"
"P. Wagner","P. Wagner","M. Clapham",26633,"P. E.",Strzelecki,,,,1845,,"Physical descriptions of New South Wales and Van Dieman’s Land",,,,1,462,"book/book chapter","stated without evidence",English,,,,,"2008-03-06 18:50:37","2012-09-08 13:34:07"
"M. Clapham","M. Clapham",,27932,"R. H.",Swart,,,,1998,"Revision of Permian pleurotomarian gastropods from the Carnarvon and Bonaparte basins, Western Australia","Proceedings of the Royal Society of Victoria",,110,1/2,163,172,"journal article","stated without evidence",English,,,,,"2008-08-10 12:45:01","2008-08-11 05:45:01"
"M. Clapham","M. Clapham",,42744,C.,Teichert,,,,1953,"A new ammonoid from the eastern Australian Permian province","Journal and Proceedings of the Royal Society of New South Wales",,87,,46,50,"journal article","stated with evidence",English,,,,,"2012-08-26 06:18:16","2012-08-26 06:18:16"
"M. Clapham","M. Clapham",,42528,C.,Teichert,"H. O.",Fletcher,,1943,"A Permian ammonoid from New South Wales and the correlation of the Upper Marine Series","Records of the Australian Museum",,21,,156,163,"journal article","stated with evidence",English,,,,,"2012-08-02 07:46:53","2012-08-02 07:46:53"
"M. Clapham","M. Clapham","M. Clapham",41227,"G. A.",Thomas,,,,1957,"Oldhaminid brachiopods in the Permian of northern Australia","Journal of the Palaeontological Society of India",,2,,174,182,"journal article","stated with evidence",English,,,,,"2012-04-21 06:07:00","2012-04-21 06:18:09"
"M. Clapham","M. Clapham","M. Clapham",27553,"G. A.",Thomas,,,,1958,"The Permian Orthotetacea of Western Australia","Bureau of Mineral Resources, Geology and Geophysics Bulletin",,39,,1,158,"serial monograph","stated without evidence",English,,,,,"2008-07-04 20:21:57","2013-04-03 07:55:16"
"M. Clapham","M. Clapham","M. Clapham",27554,"G. A.",Thomas,,,,1971,"Carboniferous and Early Permian brachiopods from western and northern Australia","Bureau of Mineral Resources, Geology and Geophysics Bulletin",,56,,1,277,"serial monograph","stated without evidence",English,,,,,"2008-07-04 20:41:25","2013-04-03 07:55:24"
"P. Wagner","P. Wagner",,26676,"R. E.",Wass,,,,1967,"New species of Permian gastropods from Queensland","Proceedings of the Linnean Society of New South Wales",,92,11,67,73,"journal article","stated without evidence",English,,,,,"2008-03-11 10:01:28","2008-03-12 04:01:28"
"M. Clapham","M. Clapham",,30258,"R. E.",Wass,,,,1967,"Permian Polyzoa from the Port Keats District, Northern Territory","Proceedings of the Linnean Society of New South Wales",,92,2,162,170,"journal article","stated with evidence",English,,,,,"2009-07-11 18:58:31","2009-07-12 11:58:31"
"M. Clapham","M. Clapham","M. Clapham",30366,"R. E.",Wass,,,,1968,"Permian Polyzoa from the Bowen Basin","Bureau of Mineral Resources, Geology and Geophysics Bulletin",,90,,1,135,"journal article","stated with evidence",English,,,,,"2009-07-18 08:55:10","2013-04-03 08:01:13"
"M. Clapham","M. Clapham",,33739,"R. E.",Wass,"M. R.",Banks,,1971,"Some Permian trilobites from eastern Australia",Palaeontology,,14,,222,241,"journal article","stated with evidence",English,,,,,"2010-08-29 22:12:03","2010-08-30 15:12:03"
