authorizer,enterer,modifier,reference_no,author1init,author1last,author2init,author2last,otherauthors,pubyr,reftitle,pubtitle,editors,pubvol,pubno,firstpage,lastpage,publication_type,basis,language,doi,comments,project_name,project_ref_no,created,modified
"M. Clapham","M. Clapham","M. Clapham",28047,"J. B.",Waterhouse,,,,1967,"A new species of Attenuatella (Brachiopoda) from Permian beds near Drake, New South Wales","Records of the Australian Museum",,27,,167,173,"journal article","stated with evidence",English,,,,,"2008-08-24 12:13:50","2013-04-03 12:08:44"
"D. Bottjer","M. Clapham","M. Clapham",11176,"J. B.",Waterhouse,,,,1968,"The classification and description of Permian Spiriferida (Brachiopoda) from New Zealand","Palaeontographica Abteilung A",,129,1-3,1,94,"journal article","stated without evidence",,,,,,"2004-07-20 13:02:02","2004-07-21 06:02:02"
"M. Clapham","M. Clapham",,27358,"J. B.",Waterhouse,,,,1968,"New species of Megousia Muir-Wood and Cooper and allied new genus from the Permian of Australia and North America","Journal of Paleontology",,42,5,1171,1185,"journal article","stated without evidence",English,,,,,"2008-06-09 17:33:34","2008-06-10 10:33:34"
"T. Olszewski","L. Fall","L. Fall",14013,"J. B.",Waterhouse,,,,1970,"Gondwanan occurrences of the upper Paleozoic brachiopod Stepanoviella","Journal of Paleontology",,44,1,37,50,"journal article","stated without evidence",English,,,,,"2005-07-27 12:41:42","2005-07-28 05:41:57"
"M. Clapham","M. Clapham",,28432,"J. B.",Waterhouse,,,,1970,"Permian brachiopod Retimarginifera n. gen. n. sp. from the Byro Group of Carnarvon Basin, Western Australia","Journal of the Royal Society of Western Australia",,53,4,120,128,"journal article","stated with evidence",English,,,,,"2008-11-09 18:06:48","2008-11-10 13:06:48"
"M. Clapham","M. Clapham","M. Clapham",33746,"J. B.",Waterhouse,,,,1979,"New members of the Atomodesminae (Bivalvia) from the Permian of Australia and New Zealand","Papers - Department of Geology, University of Queensland",,9,,1,22,"journal article","stated with evidence",English,,,,,"2010-08-29 22:16:31","2013-04-03 11:57:03"
"D. Bottjer","M. Clapham","M. Clapham",10837,"J. B.",Waterhouse,,,,1983,"Systematic description of Permian brachiopods, bivalves and gastropods below Wall Sandstone Member, northern Bowen Basin","Papers of the Department of Geology, University of Queensland",,10,3,155,179,"journal article","stated without evidence",,,,,,"2004-06-12 17:37:12","2004-06-13 10:37:12"
"M. Clapham","M. Clapham","M. Clapham",27819,"J. B.",Waterhouse,,,,1986,"New late Palaeozoic invertebrate taxa","Bulletin of the Indian Geologists' Association",,19,1,1,8,"journal article","stated with evidence",English,,,,,"2008-07-31 09:57:14","2010-04-16 10:46:24"
"P. Wagner","P. Wagner","P. Wagner",11597,"J. B.",Waterhouse,,,,1987,"Late Palaeozoic Mollusca and correlations from the south-east Bowen Basin, east Australia","Palaeontographica Abteilung A",,198,4-6,129,333,"serial monograph","stated without evidence",,,,,,"2004-09-03 11:11:47","2004-09-04 04:11:47"
"M. Clapham","M. Clapham",,27368,"J. B.",Waterhouse,,,,1987,"Late Palaeozoic Brachiopoda (Athyrida, Spiriferida and Terebratulida) from the southeast Bowen Basin, east Australia","Palaeontographica Abteilung A",,196,1-3,1,56,"journal article","stated without evidence",English,,,,,"2008-06-10 10:43:57","2008-06-11 03:43:57"
"M. Clapham","M. Clapham","M. Clapham",33926,"J. B.",Waterhouse,,,,1988,"Revision of the bivalved mollusca described by James Dwight Dana 1847-1849 from the Permian of eastern Australia","Papers - Department of Geology, University of Queensland",,12,2,165,228,"journal article","stated with evidence",English,,,,,"2010-09-20 20:26:28","2013-04-03 11:57:10"
"M. Clapham","M. Clapham","M. Clapham",35121,"J. B.",Waterhouse,"D. J. C.",Briggs,"S. M. Parfrey",1983,"Major faunal assemblages in the Early Permian Tiverton Formation near Homevale Homestead, northern Bowen Basin, Queensland","Permian Geology of Queensland",,,,121,138,"book/book chapter","stated with evidence",English,,,,,"2011-02-12 05:26:11","2011-02-12 05:49:27"
"M. Clapham","M. Clapham",,27351,"J. B.",Waterhouse,D.J.C.,Briggs,,1986,"Late Palaeozoic Scyphozoa and Brachiopoda (Inarticulata, Strophomenida, Productida and Rhynchonellida) from the southeast Bowen Basin, Australia","Palaeontographica Abteilung A",,193,1-4,1,76,"journal article","stated without evidence",English,,,,,"2008-06-09 15:05:29","2008-06-10 08:05:29"
"M. Clapham","M. Clapham",,35115,"J. B.",Waterhouse,"J. S.",Jell,,1983,"The sequence of Permian rocks and faunas near Exmoor Homestead south of Collinsville, north Bowen Basin","Permian Geology of Queensland",,,,231,267,"book/book chapter","stated with evidence",English,,,,,"2011-02-11 12:25:19","2011-02-11 12:25:19"
"M. Foote","M. Foote","M. Foote",10845,"G. E.",Webb,,,,1990,"Lower Carboniferous coral fauna of the Rockhampton Group, east-central Queensland","Memoir of the Association of Australasian Palaeontologists [J.A. Jell, ed. Devonian and Carboniferous coral studies]",,10,,1,167,"journal article","stated without evidence",,,,,,"2004-06-14 09:01:51","2004-06-15 02:01:51"
"G. Webster","G. Webster",,22996,"G. D.",Webster,,,,1987,"Permian crinoids from the type-section of the Callytharra Formation, Callytharra Springs, Western Australia",Alcheringa,,11,,95,135,"journal article","stated with evidence",English,,,,,"2007-02-26 19:07:06","2007-02-27 14:07:06"
"G. Webster","G. Webster",,22998,"G. D.",Webster,,,,1990,"New Permian crinoids from Australia",Palaeontology,,33,,49,73,"journal article","stated with evidence",English,,"3 pl.",,,"2007-02-26 19:07:06","2007-02-27 14:07:06"
"G. Webster","G. Webster",,23013,"G. D.",Webster,P.A.,Jell,,1992,"Permian echinoderms from Western Australia","Memoirs of the Queensland Museum",,32,1,311,373,"journal article","stated with evidence",English,,,,,"2007-02-26 19:07:07","2007-02-27 14:07:07"
"G. Webster","G. Webster",,23108,"R. J.",Willink,,,,1978,"Catillocrinids from the Permian of eastern Australia",Alcheringa,,2,,83,102,"journal article","stated without evidence",English,,,,,"2007-02-26 19:07:16","2007-02-27 14:07:16"
"G. Webster","G. Webster",,23109,"R. J.",Willink,,,,1979,"Some conservative and some highly-evolved Permian crinoids from eastern Australia",Alcheringa,,3,,117,134,"journal article","stated without evidence",English,,,,,"2007-02-26 19:07:16","2007-02-27 14:07:16"
"G. Webster","G. Webster","M. Clapham",23110,"R. J.",Willink,,,,1979,"The crinoid genera Tribrachyocrinus McCoy, Calceolispongia Etheridge, Jimbacrinus Teichert and Meganotocrinus n. gen. in the Permian of eastern Australia","Palaeontographica Abt. A",,165,3-6,137,194,"journal article","stated without evidence",English,,,,,"2007-02-26 19:07:16","2008-08-10 10:56:55"
"F. Fursich","F. Fursich","F. Fursich",10060,"R. J.",Willink,,,,1980,"Two new camerate crinoid species from the Permian of eastern Australia",Alcheringa,,4,3-4,227,232,"journal article","stated without evidence",,,,1%,,"2004-03-19 05:17:22","2004-03-20 00:27:03"
"G. Webster","G. Webster",,23111,"R. J.",Willink,,,,1980,"A new coiled-stemmed camerate crinoid from the Permian of eastern Australia","Journal of Paleontology",,54,,15,34,"journal article","stated without evidence",English,,,,,"2007-02-26 19:07:16","2007-02-27 14:07:16"
